{
  "schema_version": 1,
  "z": 10,
  "x": 511,
  "y": 340,
  "places": [
    {
      "place_id": "mt1_00000000000000000000000000",
      "name": "St. Pancras Clock Tower",
      "lat": 51.5308,
      "lon": -0.1257,
      "category": "architecture",
      "tier": 1,
      "score": 0.82,
      "source_refs": ["wd:Q42"]
    }
  ]
}
